{
  "required" : true ,
  "$schema" : "http://json-schema.org/draft-03/schema" ,
  "type" : "object" ,
  "properties" : {
    "renewalTerm" : {
      "type" : "string" ,
      "required" : false
    } ,
    "termType" : {
      "type" : "string" ,
      "required" : false
    } ,
    "autoRenew" : {
      "type" : "boolean" ,
      "required" : false
    } ,
    "currentTerm" : {
      "type" : "string" ,
      "required" : false
    } ,
    "update" : {
      "type" : "array" ,
      "required" : false ,
      "items" : 
        {
          "type" : "object" ,
          "properties" : {
            "ratePlanId" : {
              "type" : "string" ,
              "required" : false
            } ,
            "contractEffectiveDate" : {
              "type" : "string" ,
              "required" : false
            } ,
            "chargeUpdateDetails" : {
              "type" : "array" ,
              "required" : false ,
              "items" : 
                {
                  "type" : "object" ,
                  "properties" : {
                    "ratePlanChargeId" : {
                      "type" : "string" ,
                      "required" : false
                    } ,
                    "quantity" : {
                      "type" : "number" ,
                      "required" : false
                    }
                  }
                }
              
            }
          }
        }
      
    } ,
    "notes" : {
      "type" : "string" ,
      "required" : false
    } ,
    "myCustomField__c" : {
      "type" : "string" ,
      "required" : false
    }
  }
}